{
  "schema": "teistro-conformance/pyjhora-vimshottari/1",
  "fixture": "charts/c024-london-1947-05-18.json",
  "provenance": {
    "source": "PyJHora",
    "evidence_rank": 3,
    "tool_version": "4.8.7",
    "swisseph_version": "2.10.3.2",
    "ephemeris": "MOSHIER",
    "ayanamsha": "LAHIRI",
    "exporter_version": "1.0.0"
  },
  "inputs": {
    "jd_ut": 2432323.5625,
    "latitude_deg": 51.5074,
    "longitude_deg": -0.1278,
    "tz_offset_min": 120
  },
  "moon_sidereal_deg": 359.6995605812471,
  "durations": {
    "MEAN_SIDEREAL_YEAR": {
      "year_days": 365.256364,
      "balance_ymd": [
        0,
        4,
        18
      ],
      "periods": [
        [
          "MERCURY",
          "MERCURY",
          2426254.119509362,
          2.408333333333509
        ],
        [
          "MERCURY",
          "KETU",
          2427133.7785859955,
          0.9916666666665139
        ],
        [
          "MERCURY",
          "VENUS",
          2427495.991146962,
          2.833333333332715
        ],
        [
          "MERCURY",
          "SUN",
          2428530.8841782953,
          0.849999999999687
        ],
        [
          "MERCURY",
          "MOON",
          2428841.352087695,
          1.416666666666995
        ],
        [
          "MERCURY",
          "MARS",
          2429358.798603362,
          0.9916666666665139
        ],
        [
          "MERCURY",
          "RAHU",
          2429721.0111643285,
          2.550000000000336
        ],
        [
          "MERCURY",
          "JUPITER",
          2430652.4148925287,
          2.2666666666666817
        ],
        [
          "MERCURY",
          "SATURN",
          2431480.3293175953,
          2.691666666667163
        ],
        [
          "KETU",
          "KETU",
          2432463.477697362,
          0.4083333333333454
        ],
        [
          "KETU",
          "VENUS",
          2432612.6240459955,
          1.166666666666337
        ],
        [
          "KETU",
          "SUN",
          2433038.756470662,
          0.34999999999964615
        ],
        [
          "KETU",
          "MOON",
          2433166.596198062,
          0.5833333333331685
        ],
        [
          "KETU",
          "MARS",
          2433379.662410395,
          0.4083333333333454
        ],
        [
          "KETU",
          "RAHU",
          2433528.8087590286,
          1.0500000000002132
        ],
        [
          "KETU",
          "JUPITER",
          2433912.3279412286,
          0.9333333333328147
        ],
        [
          "KETU",
          "SATURN",
          2434253.233880962,
          1.1083333333339125
        ],
        [
          "KETU",
          "MERCURY",
          2434658.0596843953,
          0.9916666666677888
        ],
        [
          "VENUS",
          "VENUS",
          2435020.2722453624,
          3.3333333333327557
        ],
        [
          "VENUS",
          "SUN",
          2436237.7934586955,
          1.0000000000000817
        ],
        [
          "VENUS",
          "MOON",
          2436603.0498226956,
          1.6666666666663779
        ],
        [
          "VENUS",
          "MARS",
          2437211.810429362,
          1.166666666666337
        ],
        [
          "VENUS",
          "RAHU",
          2437637.9428540287,
          3.000000000000245
        ],
        [
          "VENUS",
          "JUPITER",
          2438733.7119460288,
          2.6666666666664596
        ],
        [
          "VENUS",
          "SATURN",
          2439707.7289166953,
          3.1666666666665004
        ],
        [
          "VENUS",
          "MERCURY",
          2440864.374069362,
          2.833333333332715
        ],
        [
          "VENUS",
          "KETU",
          2441899.267100695,
          1.1666666666688867
        ],
        [
          "SUN",
          "SUN",
          2442325.3995253625,
          0.29999999999951454
        ],
        [
          "SUN",
          "MOON",
          2442434.9764345624,
          0.5000000000000409
        ],
        [
          "SUN",
          "MARS",
          2442617.6046165624,
          0.34999999999964615
        ],
        [
          "SUN",
          "RAHU",
          2442745.4443439622,
          0.8999999999998185
        ],
        [
          "SUN",
          "JUPITER",
          2443074.175071562,
          0.7999999999995554
        ],
        [
          "SUN",
          "SATURN",
          2443366.380162762,
          0.9499999999999501
        ],
        [
          "SUN",
          "MERCURY",
          2443713.373708562,
          0.849999999999687
        ],
        [
          "SUN",
          "KETU",
          2444023.841617962,
          0.34999999999964615
        ],
        [
          "SUN",
          "VENUS",
          2444151.6813453618,
          1.0000000000026315
        ],
        [
          "MOON",
          "MOON",
          2444516.9377093627,
          0.8333333333338264
        ],
        [
          "MOON",
          "MARS",
          2444821.318012696,
          0.5833333333331685
        ],
        [
          "MOON",
          "RAHU",
          2445034.3842250295,
          1.5000000000001226
        ],
        [
          "MOON",
          "JUPITER",
          2445582.2687710295,
          1.3333333333338673
        ],
        [
          "MOON",
          "SATURN",
          2446069.277256363,
          1.5833333333332502
        ],
        [
          "MOON",
          "MERCURY",
          2446647.5998326964,
          1.416666666666995
        ],
        [
          "MOON",
          "KETU",
          2447165.046348363,
          0.5833333333331685
        ],
        [
          "MOON",
          "VENUS",
          2447378.1125606964,
          1.6666666666663779
        ],
        [
          "MOON",
          "SUN",
          2447986.873167363,
          0.499999999998766
        ],
        [
          "MARS",
          "MARS",
          2448169.5013493625,
          0.4083333333333454
        ],
        [
          "MARS",
          "RAHU",
          2448318.647697996,
          1.0500000000002132
        ],
        [
          "MARS",
          "JUPITER",
          2448702.166880196,
          0.9333333333328147
        ],
        [
          "MARS",
          "SATURN",
          2449043.072819929,
          1.1083333333339125
        ],
        [
          "MARS",
          "MERCURY",
          2449447.8986233626,
          0.9916666666665139
        ],
        [
          "MARS",
          "KETU",
          2449810.1111843293,
          0.4083333333333454
        ],
        [
          "MARS",
          "VENUS",
          2449959.2575329626,
          1.166666666666337
        ],
        [
          "MARS",
          "SUN",
          2450385.389957629,
          0.34999999999964615
        ],
        [
          "MARS",
          "MOON",
          2450513.229685029,
          0.5833333333344434
        ],
        [
          "RAHU",
          "RAHU",
          2450726.2958973628,
          2.6999999999994557
        ],
        [
          "RAHU",
          "JUPITER",
          2451712.4880801626,
          2.3999999999999413
        ],
        [
          "RAHU",
          "SATURN",
          2452589.1033537625,
          2.8499999999998504
        ],
        [
          "RAHU",
          "MERCURY",
          2453630.0839911625,
          2.550000000000336
        ],
        [
          "RAHU",
          "KETU",
          2454561.4877193626,
          1.0500000000002132
        ],
        [
          "RAHU",
          "VENUS",
          2454945.0069015627,
          3.000000000000245
        ],
        [
          "RAHU",
          "SUN",
          2456040.775993563,
          0.8999999999998185
        ],
        [
          "RAHU",
          "MOON",
          2456369.5067211627,
          1.5000000000001226
        ],
        [
          "RAHU",
          "MARS",
          2456917.3912671627,
          1.0500000000002132
        ],
        [
          "JUPITER",
          "JUPITER",
          2457300.910449363,
          2.1333333333334226
        ],
        [
          "JUPITER",
          "SATURN",
          2458080.124025896,
          2.5333333333332004
        ],
        [
          "JUPITER",
          "MERCURY",
          2459005.4401480295,
          2.2666666666666817
        ],
        [
          "JUPITER",
          "KETU",
          2459833.354573096,
          0.9333333333328147
        ],
        [
          "JUPITER",
          "VENUS",
          2460174.2605128293,
          2.6666666666664596
        ],
        [
          "JUPITER",
          "SUN",
          2461148.277483496,
          0.7999999999995554
        ],
        [
          "JUPITER",
          "MOON",
          2461440.4825746957,
          1.3333333333338673
        ],
        [
          "JUPITER",
          "MARS",
          2461927.4910600292,
          0.9333333333328147
        ],
        [
          "JUPITER",
          "RAHU",
          2462268.3969997624,
          2.400000000001216
        ],
        [
          "SATURN",
          "SATURN",
          2463145.012273363,
          3.008333333333813
        ],
        [
          "SATURN",
          "MERCURY",
          2464243.8251683963,
          2.691666666667163
        ],
        [
          "SATURN",
          "KETU",
          2465226.973548163,
          1.1083333333339125
        ],
        [
          "SATURN",
          "VENUS",
          2465631.7993515967,
          3.1666666666665004
        ],
        [
          "SATURN",
          "SUN",
          2466788.4445042633,
          0.9499999999999501
        ],
        [
          "SATURN",
          "MOON",
          2467135.4380500633,
          1.5833333333332502
        ],
        [
          "SATURN",
          "MARS",
          2467713.7606263966,
          1.1083333333339125
        ],
        [
          "SATURN",
          "RAHU",
          2468118.58642983,